text,emotion,bias/distortion,context,feedback/insight,behavioral_recommendation,progress_tracking,motivation,perception,habit,social_influence,attention,memory,trust,past_experience,decision_making,adaptive_behavior,identity,situational_trigger,cultural
"""After months at the gym, my body still doesn't look how I want. I lack the discipline to stick to programs properly. Why can't I get this right?""","dissatisfaction, self-criticism","disqualifying positives, labeling",fitness,Progress overshadowed by unmet ideals,Track non-aesthetic gains like strength/endurance,Fitness journey,Appearance motivation,Deficit-focused perception,Negative self-talk pattern,Body ideal influence,Attention to perceived flaws,Past fitness frustration memory,Diminished body trust,Similar past fitness plateaus,Extreme regimen decisions,Difficulty recognizing non-visual progress,Fitness failure identity,Body check situation,Idealized body standards
"""My homemade cookies spread too much while baking. I always mess up recipes somehow. Cooking just isn't one of my skills.""","dissatisfaction, self-criticism","overgeneralization, labeling",culinary,Minor mishap generalized to skill deficiency,"Analyze specific factors (butter temp, measurements)",Culinary learning process,Mastery motivation,Failure-focused perception,Kitchen frustration pattern,Cooking standard influence,Attention to mistakes,Past culinary mishap memory,Diminished cooking trust,Similar past baking frustrations,Avoidant cooking decisions,Difficulty maintaining learning perspective,Bad cook identity,Baking situation,Domestic skill expectation
"""The scarf I knitted has uneven tension. After all this time, I still can't produce perfect work like other crafters.""","dissatisfaction, self-criticism","comparison, mental filtering",creative,Handicraft progress minimized by comparison,Keep early projects to measure skill growth,Creative skill development,Perfectionism motivation,Inadequacy-focused perception,Self-criticism pattern,Crafting community influence,Attention to imperfections,Past creative frustration memory,Diminished artistic trust,Similar past craft disappointments,Avoidant creative decisions,Difficulty valuing handmade charm,Imperfect artist identity,Crafting situation,Flawless handmade ideal
"""My garden doesn't look as lush as my neighbor's. I must not have the green thumb I imagined. Maybe I should just give up on gardening.""","dissatisfaction, self-criticism","comparison, all-or-nothing thinking",hobby,Growth comparison undermining enjoyment,Research plant suitability for your conditions,Gardening learning curve,Aesthetic motivation,Lack-focused perception,Discouragement pattern,Gardening standard influence,Attention to comparisons,Past gardening disappointment memory,Diminished gardening trust,Similar past growth frustrations,Avoidant gardening decisions,Difficulty appreciating small successes,Failed gardener identity,Growing season situation,Magazine-worthy garden ideal
"""I've practiced guitar for years but still stumble through songs. Real musicians progress much faster. I'm just not talented enough.""","dissatisfaction, self-criticism","disqualifying positives, labeling",musical,Skill development compared to idealized timelines,Record progress to notice subtle improvements,Musical journey,Mastery motivation,Deficit-focused perception,Frustrated practice pattern,Musical prodigy narrative,Attention to perceived lack,Past musical frustration memory,Diminished musical trust,Similar past plateaus,Avoidant practice decisions,Difficulty valuing incremental progress,Untalented identity,Practice situation,Natural talent myth
"""My attempt at watercolor looks childish. After all these classes, I should be better by now. Maybe art isn't for me.""","dissatisfaction, self-criticism","should statements, mental filtering",artistic,Creative expression judged against external standards,Focus on expressive joy rather than technical perfection,Artistic development,Technical mastery motivation,Flaw-focused perception,Self-critical pattern,Artistic ideal influence,Attention to perceived flaws,Past artistic frustration memory,Diminished creative trust,Similar past art struggles,Avoidant creative decisions,Difficulty embracing artistic process,Failed artist identity,Art creation situation,Technical perfection valued
"""My homemade bread never has that perfect crumb. I've tried dozens of recipes without success. Baking requires precision I simply don't possess.""","dissatisfaction, self-criticism","labeling, all-or-nothing thinking",culinary,Baking challenge framed as inherent lack,"Document variables (proofing time, kitchen temp)",Baking skill development,Precision motivation,Deficit-focused perception,Kitchen frustration pattern,Artisan baking influence,Attention to imperfections,Past baking failure memory,Diminished baking trust,Similar past bread frustrations,Avoidant baking decisions,Difficulty maintaining learning perspective,Inept baker identity,Baking situation,Artisan bread ideal
"""The website I designed looks amateurish compared to professional portfolios. After all this learning, my work still isn't good enough.""","dissatisfaction, self-criticism","comparison, disqualifying positives",professional,Skill development minimized by professional comparison,Analyze specific areas for improvement,Design skill building,Professional quality motivation,Inadequacy-focused perception,Self-criticism pattern,Design standard influence,Attention to skill gaps,Past design frustration memory,Diminished creative trust,Similar past creative plateaus,Avoidant design decisions,Difficulty recognizing progress,Unskilled designer identity,Portfolio situation,Polished professional work expected
"""My holiday decorations look haphazard compared to magazine spreads. I lack the natural eye for design that others have.""","dissatisfaction, self-criticism","comparison, labeling",domestic,Personal style devalued by commercial standards,Develop signature style rather than copying ideals,Decorating expression,Aesthetic motivation,Lack-focused perception,Seasonal frustration pattern,Pinterest-perfect influence,Attention to perceived flaws,Past decorating disappointment memory,Diminished decorative trust,Similar past holiday stresses,Avoidant decorating decisions,Difficulty embracing personal taste,Design-challenged identity,Holiday situation,Picture-perfect holiday ideal
"""This new software update changed everything. Just when I mastered the old system! Maybe I'm too old to keep up with constant tech changes.""","frustration, doubt","overgeneralization, labeling",technology,Adaptation challenge with self-doubt,Focus on one new feature at a time with peer support,Tech adaptation period,Competence motivation,Overwhelmed perception,Resistance pattern,Rapid tech change influence,Attention to difficulties,Past tech frustration memory,Diminished tech adaptability trust,Similar past software transitions,Avoidant tech decisions,Difficulty maintaining learning perspective,Technologically-challenged identity,Software update situation,Constant tech fluency expected
"""My therapy progress feels stagnant. Maybe this approach doesn't work for me. What if I'm untreatable?""","frustration, doubt","all-or-nothing thinking, catastrophizing",mental health,Healing process with unrealistic expectations,Track subtle changes and discuss with therapist,Therapeutic journey,Quick-fix motivation,Stuck perception,Discouragement pattern,Therapy success stories influence,Attention to perceived lack,Past treatment frustration memory,Diminished healing trust,Similar past therapeutic plateaus,Avoidant treatment decisions,Difficulty recognizing incremental progress,Hardcase identity,Therapy progress situation,Linear recovery expectation
"""My child isn't meeting developmental milestones on time. Am I failing as a parent? What if these delays signal bigger problems?""","frustration, doubt","personalization, catastrophizing",parenting,Development worry with self-blame,Consult pediatrician while celebrating unique progress,Child development observation,Protective motivation,Threat-focused perception,Comparison pattern,Parenting standard influence,Attention to delays,Past developmental concern memory,Diminished parenting trust,Similar past growth worries,Overly cautious decisions,Difficulty maintaining developmental perspective,Inadequate parent identity,Milestone situation,Developmental timeline pressure
"""My novel manuscript keeps getting rejected. Maybe the publishing industry is right - my writing isn't good enough.""","frustration, doubt","mental filtering, labeling",creative,Rejection with talent questioning,Research targeted submissions while continuing craft development,Creative persistence challenge,Validation motivation,Rejection-focused perception,Discouragement pattern,Publishing gatekeeping influence,Attention to rejections,Past creative setback memory,Diminished artistic trust,Similar past rejection periods,Avoidant submission decisions,Difficulty maintaining creative confidence,Failed writer identity,Rejection situation,Overnight success myth
"""My team ignores my suggestions in meetings. Maybe my ideas lack value. Why bother speaking up if no one listens?""","frustration, doubt","personalization, mental filtering",professional,Contribution with perceived insignificance,Document ideas beforehand and seek one-on-one feedback,Workplace communication challenge,Impact motivation,Marginalized perception,Withdrawal pattern,Workplace dynamic influence,Attention to being overlooked,Past contribution disregard memory,Diminished professional voice trust,Similar past workplace frustrations,Avoidant participation decisions,Difficulty maintaining professional perspective,Invisible employee identity,Meeting situation,Workplace contribution valued
"""This diet/exercise plan isn't delivering promised results. Maybe my metabolism is broken beyond repair.""","frustration, doubt","catastrophizing, labeling",health,Expectation-reality gap with physiological doubt,Consult nutritionist while adjusting timeline expectations,Health journey,Quick-results motivation,Defective body perception,Discouragement pattern,Fitness marketing influence,Attention to perceived lack,Past diet frustration memory,Diminished body trust,Similar past health plan disappointments,Extreme regimen decisions,Difficulty maintaining health perspective,Broken metabolism identity,Weight situation,Rapid transformation culture
"""My attempts at meditation just leave me more frustrated. Maybe I'm too Type A for mindfulness. Some brains aren't wired for this.""","frustration, doubt","labeling, all-or-nothing thinking",wellbeing,Practice challenge with self-limiting belief,"Try active mindfulness (walking meditation, yoga)",Mindfulness adaptation,Relaxation motivation,Incompatible perception,Resistance pattern,Meditation ideal influence,Attention to difficulties,Past practice frustration memory,Diminished mindfulness trust,Similar past relaxation struggles,Avoidant practice decisions,Difficulty finding compatible techniques,Meditation-failure identity,Stress situation,Zen mastery ideal
"""Our marriage counseling isn't fixing things quickly. Maybe our problems are too deep. What if we're fundamentally incompatible?""","frustration, doubt","catastrophizing, magnification",relationship,Healing process with unrealistic timeline,Focus on small positive interactions between sessions,Relationship repair challenge,Quick-resolution motivation,Hopeless perception,Discouragement pattern,Romantic ideal influence,Attention to remaining issues,Past relationship hurt memory,Diminished relationship trust,Similar past marital frustrations,Avoidant relationship decisions,Difficulty recognizing subtle improvements,Incompatible partner identity,Therapy situation,Quick-fix relationship culture
"""My job search drags on with no offers. Maybe the market sees something wrong with me that I don't. I'll never find decent work again.""","frustration, doubt","personalization, fortune telling",career,Prolonged search with eroding self-worth,Analyze search strategy while maintaining skill development,Employment challenge,Security motivation,Defective candidate perception,Discouragement pattern,Competitive job market influence,Attention to rejections,Past job search difficulty memory,Diminished employability trust,Similar past employment gaps,Desperate application decisions,Difficulty maintaining professional perspective,Unemployable identity,Job search situation,Continuous employment norm
"""This home repair keeps defeating me. YouTube makes it look easy but I can't get it right. Maybe I'm just not handy.""","frustration, doubt","comparison, labeling",DIY,Skill development with unrealistic comparison,Seek hands-on help for first attempt,Home maintenance learning,Self-sufficiency motivation,Inept perception,Avoidance pattern,DIY media influence,Attention to failures,Past repair frustration memory,Diminished handyman trust,Similar past DIY struggles,Avoidant maintenance decisions,Difficulty valuing learning process,Unhandy identity,Home repair situation,Masculine competence stereotype
"""The cancer screening callback has me paralyzed. It's definitely bad news. I can't handle treatment - I'll just fall apart completely.""","terror, helplessness","catastrophizing, fortune telling",health,Medical uncertainty escalated to certain doom,Schedule appointment with support person,Health anxiety crisis,Survival motivation,Threat-dominated perception,Avoidance pattern,Medical fear influence,Hyperfocus on worst case,Past health scare memory,Diminished coping trust,Similar past health anxieties,Avoidant medical decisions,Difficulty maintaining medical perspective,Doomed patient identity,Health scare situation,Health control valued
"""The home invasion news has me barricading doors at night. They'll target me next and no one will help. I can't sleep imagining the violence.""","terror, helplessness","personalization, magnification",safety,Crime awareness creating hypervigilance,Implement realistic security measures with therapy support,Safety anxiety period,Protection motivation,Threat-dominated environment perception,Security ritual pattern,Crime media influence,Hyperfocus on danger,Past trauma memory,Diminished safety trust,Similar past safety fears,Extreme protection decisions,Difficulty maintaining safety perspective,Victim identity,Crime report situation,Safety expectation
"""My child's high fever won't break. What if it causes permanent damage? I'm powerless to help and the doctors aren't taking it seriously enough.""","terror, helplessness","catastrophizing, mind reading",parenting,Health crisis with perceived inadequate response,Document symptoms objectively while utilizing nurse line,Child illness challenge,Protective motivation,Threat-dominated health perception,Medical seeking pattern,Parenting fear influence,Hyperfocus on symptoms,Past medical emergency memory,Diminished medical system trust,Similar past child illnesses,Overmedicalizing decisions,Difficulty maintaining medical perspective,Failed protector identity,Sick child situation,Parental responsibility pressure
"""The plane turbulence felt like we were plummeting. I'll never fly again - next time we'll crash for sure. I can't stop reliving those terrifying drops.""","terror, helplessness","overgeneralization, emotional reasoning",travel,Traumatic travel experience generalized,Practice gradual exposure with calming techniques,Travel anxiety management,Survival motivation,Threat-dominated travel perception,Travel avoidance pattern,Travel fear influence,Hyperfocus on danger,Vivid trauma memory,Diminished aviation trust,Similar past travel fears,Avoidant travel decisions,Difficulty maintaining travel perspective,Trauma survivor identity,Turbulence situation,Travel ease expected
"""The political unrest has me convinced society is collapsing. I lie awake planning how to protect my family when everything falls apart.""","terror, helplessness","catastrophizing, dichotomous thinking",current events,World events interpreted as existential threat,Limit news consumption while focusing on local stability,Societal anxiety period,Survival motivation,Apocalyptic perception,Doomsday preparation pattern,Alarmist media influence,Hyperfocus on instability,Past crisis memory,Diminished societal trust,Similar past political fears,Extreme preparedness decisions,Difficulty maintaining societal perspective,Survivalist identity,Political turmoil situation,Stability expectation
"""My partner's angry outburst triggered flashbacks to childhood abuse. I'm that powerless child again, frozen in terror. I'll never feel safe in relationships.""","terror, helplessness","emotional reasoning, overgeneralization",trauma,Past trauma contaminating present relationship,Establish safety plan while seeking trauma therapy,Trauma response period,Safety motivation,Threat-dominated relationship perception,Withdrawal pattern,Trauma history influence,Hyperfocus on threat cues,Vivid trauma memory,Diminished relationship safety trust,Similar past trauma responses,Avoidant relationship decisions,Difficulty maintaining present perspective,Trauma victim identity,Conflict situation,Relationship safety expected
"""The doctor mentioned 'possible autoimmune disorder.' I've read how these diseases destroy lives. My future is just endless suffering and decline.""","terror, helplessness","catastrophizing, fortune telling",health,Medical possibility escalated to certain doom,Seek second opinion while limiting medical research,Health diagnosis anxiety,Survival motivation,Threat-dominated future perception,Health rumination pattern,Worst-case influence,Hyperfocus on dire outcomes,Past health anxiety memory,Diminished medical trust,Similar past health fears,Avoidant health decisions,Difficulty maintaining health perspective,Doomed patient identity,Diagnostic situation,Health certainty valued
"""The break-in at our building has me terrified. They'll come back when I'm alone. I've barricaded myself in the bedroom with a knife, too scared to sleep.""","terror, helplessness","personalization, magnification",safety,Crime event creating hypervigilance,Install security system with trauma therapy support,Post-crime anxiety,Protection motivation,Threat-dominated home perception,Safety ritual pattern,Crime impact influence,Hyperfocus on danger,Vivid crime memory,Diminished home safety trust,Similar past safety fears,Extreme protection decisions,Difficulty maintaining safety perspective,Victim identity,Burglary situation,Home safety norm
"""My panic attacks are getting worse. What if I lose control completely in public? End up institutionalized? These episodes feel like dying.""","terror, helplessness","catastrophizing, emotional reasoning",mental health,Anxiety interpreted as existential threat,Practice grounding techniques with therapy support,Anxiety management challenge,Survival motivation,Threat-dominated body perception,Fear monitoring pattern,Mental health stigma influence,Hyperfocus on physical symptoms,Past panic memory,Diminished self-regulation trust,Similar past panic episodes,Avoidant public decisions,Difficulty maintaining anxiety perspective,Mental patient identity,Panic situation,Emotional control expected
"""The hurricane warning has me paralyzed. We won't survive if it hits here. I'm obsessively tracking every update, unable to think of anything else.""","terror, helplessness","catastrophizing, magnification",environment,Weather threat creating hypervigilance,Create practical preparedness plan with anxiety management,Weather anxiety period,Survival motivation,Threat-dominated environmental perception,Obsessive monitoring pattern,Disaster media influence,Hyperfocus on danger,Past weather trauma memory,Diminished safety trust,Similar past weather fears,Extreme preparedness decisions,Difficulty maintaining threat perspective,Doomsday identity,Storm situation,Safety preparation valued
"""After the miscarriage, I can't look at baby announcements without crumbling. My body failed at its most basic function - what good am I?""","devastation, self-doubt","personalization, labeling",reproductive loss,Grief compounded by self-blame,Seek pregnancy loss support groups to process grief,Bereavement journey,Self-worth motivation,Failure-focused perception,Avoidance pattern,Motherhood expectation pressure,"Hyperfocus on physical ""failure""",Selective recall of bodily inadequacy,Diminished trust in body's capability,Similar past losses,Isolation decisions,Difficulty separating worth from fertility,"""Failed woman"" identity",Pregnancy announcement situation,Perfect fertility expectation
"""My business collapsed after ten years. The bankruptcy papers finalized today - I'm not just broke but a complete fraud who fooled everyone.""","devastation, self-doubt","overgeneralization, labeling",career,Professional loss with identity crisis,Extract transferable skills from the experience,Career transition,Reinvention motivation,Fraudulence-focused perception,Self-flagellation pattern,Entrepreneurial success narratives,Hyperfocus on failure aspects,Selective recall of business missteps,Fundamental self-trust rupture,Similar past professional setbacks,Avoidance decisions,Difficulty maintaining self-concept,"""Disgraced professional"" identity",Business closure situation,Perfect entrepreneurial success
"""My spouse left after twenty years saying they never loved me. Our entire marriage was a lie - how could I be so blind?""","devastation, self-doubt","emotional reasoning, magnification",relationship,Betrayal with self-perception collapse,Process betrayal trauma in therapeutic setting,Relationship ending,Self-redefinition motivation,Deception-focused perception,Rumination pattern,Romantic destiny myths,Hyperfocus on perceived naivety,Selective recall of missed warning signs,Diminished trust in judgment,Similar past relational disappointments,Avoidance decisions,Difficulty rebuilding self-trust,"""Foolish partner"" identity",Divorce initiation situation,Perfect marital insight
"""The adoption fell through at the last moment. The birth mother changed her mind - was I never worthy of parenthood to begin with?""","devastation, self-doubt","personalization, fortune telling",family,Adoption disruption grief,Seek specialized counseling for adoption loss,Adoption journey,Belonging motivation,Rejection-focused perception,Withdrawal pattern,Adoption success narratives,Hyperfocus on perceived unworthiness,Selective recall of past rejections,Diminished trust in family formation,Similar past adoption hurdles,Avoidance decisions,Difficulty maintaining hope,"""Unchosen parent"" identity",Adoption reversal situation,Perfect adoption process
"""My manuscript was rejected by every publisher. Years of work deemed worthless - I must have been delusional to think I could write.""","devastation, self-doubt","mental filtering, labeling",creative,Creative rejection with self-concept crisis,Separate work rejection from personal worth,Creative resilience,Authentic expression motivation,Failure-focused perception,Abandonment urges,Publishing industry gatekeeping,Hyperfocus on rejection letters,Selective recall of creative failures,Diminished trust in artistic voice,Similar past creative setbacks,Avoidance decisions,Difficulty maintaining creative practice,"""Failed artist"" identity",Final rejection situation,Overnight success myth
"""Failed the bar exam again. After three attempts, maybe the universe is screaming I'm not cut out to be a lawyer despite my degree.""","devastation, self-doubt","magnification, fortune telling",education,Professional qualification crisis,Analyze specific weak areas for targeted study,Exam preparation,Professional identity motivation,Defect-focused perception,Defeatist pattern,High-stakes testing culture,Hyperfocus on exam failures,Selective recall of academic struggles,Diminished trust in professional destiny,Similar past test failures,Avoidance decisions,Difficulty maintaining study persistence,"""Professional misfit"" identity",Exam results situation,Perfect test performance
"""My child was diagnosed with severe autism. All my parenting must have been wrong - what did I do to cause this?""","devastation, self-doubt","personalization, emotional reasoning",parenting,Diagnosis grief with self-blame,Connect with neurodiversity-affirming parent groups,Diagnosis adjustment,Acceptance motivation,Failure-focused perception,Self-blame pattern,Parenting perfection myths,Hyperfocus on perceived causation,Selective recall of parenting choices,Diminished trust in parental adequacy,Similar past diagnostic challenges,Overcompensation decisions,Difficulty accepting neurodiversity,"""Failed parent"" identity",Diagnosis situation,Perfect child development
"""The fire destroyed my life's work - decades of research gone. Without those notebooks, my career is over and my contributions meaningless.""","devastation, self-doubt","catastrophizing, all-or-nothing thinking",career,Professional material loss,Reconstruct work from memory and collaborate with colleagues,Professional recovery,Meaning-making motivation,Void-focused perception,Despair pattern,Academic permanence ideals,Hyperfocus on material loss,Selective recall of unpublished work,Diminished trust in knowledge retention,Similar past data losses,Avoidance decisions,Difficulty beginning reconstruction,"""Erased professional"" identity",Disaster aftermath situation,Perfect work preservation
