text,emotion,bias/distortion,context,feedback/insight,behavioral_recommendation,progress_tracking,motivation,perception,habit,social_influence,attention,memory,trust,past_experience,decision_making,adaptive_behavior,identity,situational_trigger,cultural
"""My language learning app streak broke after 200 days. All that effort for nothing - I'll never be fluent if I can't even maintain consistency.""","frustration, self-criticism","all-or-nothing thinking, catastrophizing",learning,Routine break with exaggerated consequence fears,Restart streak while honoring prior commitment,Language acquisition,Growth motivation,Failure-focused learning perception,Perfectionist practice pattern,Language learning myths influence,Focus on broken streak,Selective recall of lapses,Diminished trust in learning discipline,Similar past routine breaks,All-or-nothing decisions,Difficulty maintaining flexible practice,"""Inconsistent learner"" self-concept",Streak loss situation,Perfect consistency ideal
"""The more I try to relax, the more anxious I become about not relaxing properly. It's frustrating - why can't I just turn my brain off like normal people?""","paradoxical anxiety, frustration","should statements, comparison",wellbeing,Relaxation effort creating performance anxiety,Practice non-striving awareness while accepting natural rhythms,Stress management,Calm motivation,Failure-focused relaxation perception,Forced relaxation pattern,Wellness culture influence,Focus on relaxation failure,Selective recall of struggle,Diminished trust in natural calm,Similar past relaxation challenges,Avoidance decisions,Difficulty allowing spontaneous calm,"""Bad relaxer"" identity",Downtime situation,Instant calm expectation
"""I'm anxious about social events but frustrated when I'm not invited. I want connection but panic when it's available - what's wrong with me?""","paradoxical anxiety, frustration","emotional reasoning, labeling",social,Social needs conflict with anxiety response,Gradual exposure while honoring authentic social appetite,Social connection,Belonging motivation,Threat-reward social perception,Approach-avoidance pattern,Social extroversion ideal,Split attention on desire/fear,Conflicting social memories,Ambivalent trust in social self,Similar past social conflicts,Inconsistent decisions,Difficulty balancing social needs,"""Conflicted socializer"" identity",Invitation situation,Constant sociability valued
"""I desperately want a relationship but panic when someone shows interest. This push-pull is exhausting - I'll never have love if I can't get past this.""","paradoxical anxiety, frustration","fortune telling, emotional reasoning",dating,Intimacy desire conflicting with vulnerability fears,Explore attachment patterns while pacing relationship steps,Romantic growth,Connection motivation,Threat-reward relationship perception,Hot-cold pattern,Romantic ideal influence,Split attention on desire/fear,Conflicting relationship memories,Ambivalent trust in relational capacity,Similar past intimacy conflicts,Mixed signals decisions,Difficulty integrating vulnerability,"""Fearful romantic"" identity",Romantic opportunity situation,Effortless love myth
"""I'm anxious about being unproductive but frustrated when I try to work. The pressure to perform makes starting impossible - I'm stuck in this maddening loop.""","paradoxical anxiety, frustration","all-or-nothing thinking, magnification",work,Productivity pressure creating performance anxiety,Implement micro-productivity sessions while reducing self-judgment,Work process,Achievement motivation,Threat-focused work perception,Procrastination-urgency cycling,Hustle culture influence,Split attention on shoulds/can'ts,Conflicting work memories,Diminished trust in work capacity,Similar past productivity struggles,Avoidance decisions,Difficulty finding work rhythm,"""Blocked creator"" identity",Work demand situation,Constant productivity expected
"""I crave creative expression but freeze up when I try to create. This tension between wanting to make art and fearing bad art is torture.""","paradoxical anxiety, frustration","perfectionism, emotional reasoning",creative,Creative desire conflicting with judgment fears,Focus on process over product through small experiments,Creative expression,Authenticity motivation,Threat-focused creation perception,Creative avoidance pattern,Artistic genius myths,Split attention on desire/fear,Conflicting creative memories,Ambivalent trust in creative voice,Similar past creative blocks,Self-censorship decisions,Difficulty separating art from self,"""Blocked artist"" identity",Creative opportunity situation,Perfect art expected
"""I'm anxious about health but frustrated by health anxiety. Monitoring symptoms makes me feel worse, but not monitoring makes me panic - there's no winning.""","paradoxical anxiety, frustration","catastrophizing, emotional reasoning",health,Health concern conflicting with anxiety about concern,Establish balanced check-in routines while redirecting focus,Health management,Wellness motivation,Threat-focused body perception,Compulsive checking pattern,Health perfectionism influence,Split attention on body/mind,Conflicting health memories,Diminished trust in body signals,Similar past health anxiety cycles,Over/under monitoring decisions,Difficulty finding health balance,"""Hypochondriac"" identity",Bodily sensation situation,Perfect health ideal
"""I want to speak up in meetings but panic when I try. This conflict between wanting to contribute and fearing judgment is paralyzing.""","paradoxical anxiety, frustration","mind reading, magnification",professional,Contribution desire conflicting with evaluation fears,Prepare brief comments while accepting imperfect delivery,Professional voice,Contribution motivation,Threat-focused participation perception,Silence-regret cycling,Workplace performance culture,Split attention on shoulds/can'ts,Conflicting meeting memories,Ambivalent trust in professional value,Similar past speaking challenges,Avoidance decisions,Difficulty integrating professional voice,"""Silent professional"" identity",Group meeting situation,Flawless articulation valued
"""I'm anxious about loneliness but frustrated by socializing. I crave connection but find interactions draining - why can't I just be normal?""","paradoxical anxiety, frustration","should statements, labeling",social,Social needs conflict with energy reality,"Curate small, meaningful interactions honoring true social needs",Social energy,Connection motivation,Threat-reward social perception,Social burnout pattern,Extroversion ideal influence,Split attention on desire/fear,Conflicting social memories,Ambivalent trust in social style,Similar past social conflicts,Over/under socializing decisions,Difficulty accepting authentic social rhythm,"""Introvert misfit"" identity",Social expectation situation,Constant sociability norm
"""I'm desperate to sleep but the more I try, the more anxious I become about insomnia. This frustration about not sleeping makes sleep impossible.""","paradoxical anxiety, frustration","catastrophizing, emotional reasoning",wellbeing,Sleep effort creating performance anxiety,Implement sleep hygiene while practicing wakeful acceptance,Sleep health,Rest motivation,Threat-focused sleep perception,Sleep striving pattern,Sleep perfection myths,Hyperfocus on sleep failure,Selective recall of sleeplessness,Diminished trust in sleep capacity,Similar past insomnia episodes,Bedtime avoidance decisions,Difficulty allowing natural sleep,"""Insomniac"" identity",Bedtime situation,Perfect sleep expected
"""I want to be present with my kids but anxiety keeps pulling me into the future. This conflict between wanting to enjoy parenting and fearing I'm failing is heartbreaking.""","paradoxical anxiety, frustration","fortune telling, magnification",parenting,Parenting presence conflicting with future fears,Practice brief mindful moments while accepting imperfect presence,Parent-child connection,Love motivation,Threat-focused parenting perception,Distraction-regret cycling,Perfect parenting myths,Split attention on now/then,Conflicting parenting memories,Ambivalent trust in parenting capacity,Similar past presence struggles,Overcompensation decisions,Difficulty staying in parenting moment,"""Distracted parent"" identity",Childhood moment situation,Perfect presence expectation
"""Since moving to this new city, I doubt whether I'll ever make real friends here. Everyone seems to have established circles already - I feel completely invisible.""","doubt, isolation","mind reading, overgeneralization",relocation,New environment social doubt,"Initiate small, consistent social efforts in manageable doses",Social rebuilding,Connection motivation,Threat-focused social perception,Social withdrawal pattern,Established community influence,Focus on exclusion signs,Selective recall of loneliness,Diminished trust in social adaptability,Similar past relocation challenges,Avoidance decisions,Difficulty initiating connections,"""Perpetual outsider"" identity",New city situation,Instant belonging expectation
"""My divorce left me doubting whether I'm capable of healthy love. Watching couples together makes me feel fundamentally different - like I'm observing humanity from behind glass.""","doubt, isolation","emotional reasoning, overgeneralization",relationship,Post-divorce alienation with self-doubt,Explore personal values while allowing gradual trust rebuilding,Post-relationship adjustment,Self-understanding motivation,Separation-focused world perception,Social comparison pattern,Couple-centric culture influence,Focus on relational differences,Selective recall of love failures,Fundamental trust disruption,Integration of relationship ending,Self-protective decisions,Difficulty envisioning future connection,"""Unlovable"" identity",Social event situation,Couplehood as norm
"""As the only person of my background at work, I constantly doubt whether I truly belong. The isolation exhausts me - like I'm performing rather than being myself.""","doubt, isolation","mind reading, personalization",workplace,Minority status alienation with authenticity doubts,Seek affirming spaces while practicing authentic self-expression,Workplace inclusion,Authenticity motivation,Threat-focused professional perception,Code-switching pattern,Homogeneous workplace influence,Hypervigilance to difference,Selective recall of exclusion,Diminished trust in professional belonging,Similar past alienation experiences,Exhaustive adaptation decisions,Difficulty balancing authenticity/safety,"""Cultural outsider"" identity",Majority environment situation,Conformity expectation
"""Since leaving my religion, I doubt whether I'll ever find meaningful community again. The isolation feels permanent - like I speak a language no one understands.""","doubt, isolation","fortune telling, emotional reasoning",belief,Faith transition alienation,Explore diverse communities while honoring authentic values,Belief transformation,Meaning motivation,Separation-focused social perception,Isolation pattern,Former community influence,Focus on ideological differences,Selective recall of disconnect,Fundamental trust disruption,Integration of belief change,Self-protective decisions,Difficulty envisioning new belonging,"""Spiritual orphan"" identity",Religious event situation,Shared belief as norm
"""Chronic illness makes me doubt I'll ever feel connected again. Healthy people can't understand this reality - the isolation is its own relentless symptom.""","doubt, isolation","mind reading, overgeneralization",health,Health condition alienation,Seek peer support while practicing self-compassion,Illness adaptation,Understanding motivation,Separation-focused body perception,Withdrawal pattern,Able-bodied world influence,Focus on health differences,Selective recall of disconnect,Diminished trust in shared experience,Similar past isolation episodes,Avoidance decisions,Difficulty finding adaptive connection,"""Medical outsider"" identity",Health disparity situation,Health as default
"""As a childfree woman, I often doubt my place in society. Baby showers and parenting talk make me feel like an alien observing human rituals I'll never understand.""","doubt, isolation","emotional reasoning, magnification",social,Lifestyle difference alienation,Curate meaningful connections beyond parental status,Life path validation,Authenticity motivation,Difference-focused social perception,Defensive withdrawal pattern,Pronatalist culture influence,Hyperfocus on family/non-family divide,Selective recall of exclusion,Diminished trust in social inclusion,Similar past alienation experiences,Avoidance decisions,Difficulty asserting alternative path,"""Non-traditional woman"" identity",Family-centric event situation,Parenthood as norm
"""Recovery makes me doubt whether I'll ever feel normal in social situations. Watching people drink freely, I feel like an anthropologist studying a foreign culture I can't rejoin.""","doubt, isolation","fortune telling, comparison",wellbeing,Sobriety alienation,Build sober connections while honoring recovery pride,Recovery journey,Health motivation,Separation-focused social perception,Avoidance pattern,Drinking culture influence,Focus on consumption differences,Selective recall of disconnect,Diminished trust in sober socializing,Similar past recovery challenges,Isolation decisions,Difficulty envisioning sober connection,"""Recovering outsider"" identity",Drinking event situation,Alcohol as social norm
"""Creative rejection makes me doubt whether I belong in artistic circles. Successful artists seem like a different species - their confidence highlights my isolation.""","doubt, isolation","comparison, overgeneralization",creative,Artistic community alienation with self-doubt,Focus on authentic expression over external validation,Creative development,Authentic expression motivation,Threat-focused artistic perception,Withdrawal pattern,Art world hierarchy influence,Focus on perceived gaps,Selective recall of rejection,Diminished trust in creative belonging,Similar past creative setbacks,Avoidance decisions,Difficulty maintaining creative community,"""Failed artist"" identity",Artistic event situation,Overnight success myths
"""As a stay-at-home dad, I often doubt my place at playgrounds. The moms' easy camaraderie highlights my isolation - like I'm trespassing in maternal territory.""","doubt, isolation","mind reading, magnification",parenting,Non-traditional parent role alienation,Initiate connections while reframing parenting identity,Parenting adaptation,Family motivation,Threat-focused parenting perception,Self-consciousness pattern,Gender parenting norms influence,Hyperfocus on role differences,Selective recall of exclusion,Diminished trust in parenting community,Similar past alienation experiences,Avoidance decisions,Difficulty asserting alternative model,"""Gender outlier parent"" identity",Parenting group situation,Motherhood as default
"""Financial struggle makes me doubt I'll ever feel comfortable among successful friends. Their casual talk about vacations and renovations highlights my painful isolation.""","doubt, isolation","comparison, overgeneralization",financial,Economic status alienation,Practice authentic connection while setting compassionate boundaries,Financial challenge,Dignity motivation,Difference-focused social perception,Withdrawal pattern,Consumer culture influence,Hyperfocus on wealth gaps,Selective recall of disconnect,Diminished trust in cross-class friendship,Similar past money struggles,Avoidance decisions,Difficulty maintaining self-worth,"""Economic outsider"" identity",Wealth disparity situation,Affluence as norm
"""I've been given conflicting medical advice about my condition and don't know what to believe. The confusion makes me anxious - what if I choose the wrong treatment?""","confusion, anxiety","catastrophizing, magnification",health,Medical uncertainty triggering decision paralysis,Seek second opinion while listing specific pros/cons for each option,Health decision process,Wellness motivation,Threat-focused health perception,Information overload pattern,Conflicting expert opinions,Split attention on options,Selective recall of medical errors,Diminished trust in medical systems,Similar past health confusions,Avoidance decisions,Difficulty committing to treatment,"""Confused patient"" identity",Treatment choice situation,Certainty expectation
"""The therapist asked about my childhood and now I'm overwhelmed with mixed memories. I can't tell what's normal or problematic - this confusion makes me anxious to continue.""","confusion, anxiety","emotional reasoning, labeling",therapy,Memory ambiguity triggering therapeutic resistance,Journal specific memories without immediate interpretation,Therapeutic exploration,Self-understanding motivation,Threat-focused past perception,Avoidance pattern,Therapy myths influence,Scattered attention on memories,Fragmented autobiographical memory,Diminished trust in recall accuracy,Similar past memory uncertainties,Avoidance decisions,Difficulty tolerating ambiguity,"""Unreliable rememberer"" identity",Memory exploration situation,Clear narrative expected
"""My boss gave vague feedback about 'performance issues' but no specifics. This confusing criticism makes me anxious - how can I improve if I don't understand the problem?""","confusion, anxiety","mind reading, personalization",work,Ambiguous evaluation triggering insecurity,Request specific examples while documenting own performance,Professional development,Competence motivation,Threat-focused work perception,Rumination pattern,Unclear workplace standards,Hyperfocus on possible flaws,Selective recall of criticism,Diminished trust in managerial fairness,Similar past feedback confusions,Defensive decisions,Difficulty maintaining self-assessment,"""Confused employee"" identity",Ambiguous feedback situation,Clear metrics valued
"""The political news is so contradictory I don't know what to believe anymore. This confusion makes me anxious - how can I make informed decisions about important issues?""","confusion, anxiety","all-or-nothing thinking, catastrophizing",media,Information overload triggering civic disorientation,Limit news intake while identifying reliable fact-checked sources,Media consumption,Understanding motivation,Threat-focused information perception,Compulsive checking pattern,Polarized media influence,Scattered attention on conflicts,Selective recall of misinformation,Diminished trust in information systems,Similar past news confusions,Avoidance decisions,Difficulty maintaining media literacy,"""Disoriented citizen"" identity",Information overload situation,Clear truth expected
"""My partner sends mixed signals about commitment that confuse me. The uncertainty makes me anxious - are we moving forward or is this relationship stagnating?""","confusion, anxiety","emotional reasoning, fortune telling",relationship,Ambiguous communication triggering relationship anxiety,Initiate specific clarification conversation when calm,Relationship evaluation,Security motivation,Threat-focused love perception,Overanalysis pattern,Unclear relationship norms,Hyperfocus on mixed messages,Selective recall of uncertainties,Diminished trust in partner's intentions,Similar past relationship confusions,Avoidance decisions,Difficulty tolerating relationship ambiguity,"""Confused partner"" identity",Unclear commitment situation,Clear relationship stages expected
"""The doctor used medical jargon I didn't understand during my consultation. Now I'm confused and anxious - did I miss something important about my health?""","confusion, anxiety","catastrophizing, magnification",healthcare,Professional communication gap triggering health anxiety,Prepare specific questions for follow-up appointment,Health understanding,Wellness motivation,Threat-focused body perception,Avoidance pattern,Medical authority influence,Focus on unknown terms,Selective recall of medical confusions,Diminished trust in healthcare communication,Similar past medical misunderstandings,Avoidance decisions,Difficulty asserting information needs,"""Medically confused"" identity",Doctor visit situation,Clear explanations expected
"""I received conflicting parenting advice from family members. This confusion makes me anxious - what if I damage my child by making the wrong choices?""","confusion, anxiety","personalization, catastrophizing",parenting,Contradictory guidance triggering parental insecurity,Research evidence-based practices while honoring parental instincts,Parenting approach,Child wellbeing motivation,Threat-focused parenting perception,Inconsistent application pattern,Competing parenting philosophies,Split attention on advice,Selective recall of parenting doubts,Diminished trust in parental judgment,Similar past parenting confusions,Avoidance decisions,Difficulty maintaining consistent approach,"""Confused parent"" identity",Parenting decision situation,Perfect parenting myth
"""The job description lists contradictory requirements that confuse me. Now I'm anxious about the interview - how can I present myself when I don't understand what they want?""","confusion, anxiety","mind reading, fortune telling",career,Ambiguous expectations triggering professional anxiety,Prepare to ask clarifying questions during interview,Job application,Employment motivation,Threat-focused opportunity perception,Over-preparation pattern,Vague job postings influence,Focus on contradictions,Selective recall of interview failures,Diminished trust in employer clarity,Similar past application confusions,Avoidance decisions,Difficulty presenting adaptable skills,"""Confused applicant"" identity",Job ambiguity situation,Clear requirements expected
"""My spiritual beliefs feel increasingly confusing as I encounter new philosophies. This uncertainty makes me anxious - what if I lose my moral compass entirely?""","confusion, anxiety","catastrophizing, emotional reasoning",belief,Ideological exploration triggering existential anxiety,Journal specific questions without pressure for immediate answers,Belief exploration,Meaning motivation,Threat-focused belief perception,Avoidance pattern,Competing worldviews influence,Scattered attention on ideas,Selective recall of belief crises,Diminished trust in inner wisdom,Similar past spiritual confusions,Avoidance decisions,Difficulty tolerating belief evolution,"""Seeker"" identity",Ideological exposure situation,Certain faith expected
"""The financial advisor recommended contradictory investment strategies. This confusion makes me anxious - what if I lose my life savings by making the wrong choice?""","confusion, anxiety","magnification, fortune telling",finance,Mixed professional advice triggering money anxiety,Seek second opinion while clarifying personal risk tolerance,Financial planning,Security motivation,Threat-focused money perception,Paralysis pattern,Conflicting financial advice,Split attention on options,Selective recall of financial mistakes,Diminished trust in financial guidance,Similar past money confusions,Avoidance decisions,Difficulty committing to strategy,"""Financially confused"" identity",Investment decision situation,Clear financial paths expected
"""My friends say I'm good at writing, but I suspect they're just being nice. When I read published authors, my work seems amateurish by comparison.""","skepticism, self-doubt","comparison, disqualifying the positive",creative,Talent skepticism despite external validation,Submit work for impartial evaluation while practicing self-compassion,Creative development,Authenticity motivation,Flaw-focused creative perception,Self-rejection pattern,Literary perfectionism,Hyperfocus on perceived gaps,Selective recall of creative failures,Diminished trust in external praise,Similar past validation doubts,Avoidance decisions,Difficulty internalizing strengths,"""Imposter writer"" identity",Creative sharing situation,Artistic genius myth
"""The therapist says I'm making progress, but I doubt her assessment. She's probably just saying that to keep me as a client - I don't feel any different.""","skepticism, self-doubt","mind reading, emotional reasoning",therapy,Professional validation skepticism,Track specific behavioral changes between sessions,Therapeutic progress,Self-understanding motivation,Stagnation-focused perception,Progress dismissal pattern,Therapeutic skepticism influence,Focus on lack of feeling,Selective recall of struggles,Diminished trust in therapeutic process,Similar past professional praise doubts,Resistance decisions,Difficulty recognizing subtle changes,"""Therapy-resistant"" identity",Progress review situation,Dramatic transformation expected
"""My partner says they love me, but I keep looking for hidden meanings. What if they're just saying it out of habit or pity, not real feeling?""","skepticism, self-doubt","emotional reasoning, mind reading",relationship,Love expression skepticism,Practice accepting affection at face value while noting consistent actions,Relationship security,Connection motivation,Threat-focused love perception,Hypervigilance pattern,Romantic cynicism influence,Focus on possible deception cues,Selective recall of relationship doubts,Diminished trust in partner's honesty,Similar past intimacy fears,Testing behaviors,Difficulty receiving love,"""Unlovable doubter"" identity",Affection expression situation,Perfect love expected
