text,emotion,bias/distortion,context,feedback/insight,behavioral_recommendation,progress_tracking,motivation,perception,habit,social_influence,attention,memory,trust,past_experience,decision_making,adaptive_behavior,identity,situational_trigger,cultural
"""I feel both deep gratitude for my comfortable life and guilt that I'm not sufficiently appreciating my privilege. My contentment sometimes feels like moral failing.""",warmth,"emotional reasoning, magnification",wellbeing,Privilege awareness with disproportionate responsibility,Channel feelings into specific gratitude practices and meaningful contributions,Ethical living development,Contentment with social awareness motivation,Skewed privilege perception,Gratitude practice pattern,Social comparison influence,Attention to life advantages,Creation of privilege consciousness memory,Complex trust in personal worth,Similar past guilt episodes,Values-driven decision-making,Difficulty balancing appreciation and action,Global citizen identity,Privilege awareness situation,Grateful living valued
"""Since my diagnosis, I've gained profound appreciation for small joys but also struggle with envy toward healthy people. Their thoughtless vitality feels like a personal affront some days.""",bittersweet joy,"emotional reasoning, personalization",health,Illness perspective with comparative suffering,Cultivate specific mindfulness practices while honoring difficult emotions,Health adaptation period,Acceptance with self-compassion motivation,Contrast-enhanced perception,Appreciation-envy pattern,Health comparison influence,Attention to ability differences,Creation of illness perspective memory,Conditional trust in life value,Integration of health changes,Health-informed decision-making,Difficulty maintaining balanced perspective,Patient identity integration,Health challenge situation,Illness resilience valued
"""I feel both excited about immigrating and grief for all I'm leaving behind. Every new opportunity is shadowed by loss of familiar comforts and relationships.""",mixed joy/sadness,"emotional reasoning, mental filtering",life transition,Cultural transition with complex emotional layers,Create specific connection maintenance plans while embracing new experiences,Immigration adjustment period,Opportunity with belonging motivation,Bittersweet transition perception,Cultural bridging pattern,Diaspora community influence,Attention to gain/loss balance,Creation of migration memory,Developing trust in adaptation capacity,Integration of cultural experiences,Transition-supporting decision-making,Difficulty balancing old and new identities,Immigrant identity forming,Relocation situation,Cultural adaptation valued
"""I'm proud of my recovery progress but terrified of relapse. Every healthy choice feels fragile, like one misstep could undo years of work.""",optimism,"emotional reasoning, catastrophizing",addiction,Recovery with persistent vulnerability fear,Develop specific relapse prevention plan while celebrating milestones,Recovery maintenance period,Health with self-protection motivation,Threat-filtered progress perception,Vigilance pattern,Recovery community influence,Attention to risk factors,Creation of recovery memory,Conditional trust in sober self,Integration of relapse experiences,Recovery-supporting decision-making,Difficulty internalizing recovery stability,Recovering identity,Recovery challenge situation,Sobriety valued
"""I feel both deep love for my aging dog and dread of impending loss. Our walks are now bittersweet, noticing each new limitation while cherishing remaining time.""",tenderness,"emotional reasoning, fortune telling",pet ownership,Anticipatory grief with present-moment appreciation,Create specific memory preservation projects while staying attentive to current joys,Pet aging period,Connection with emotional preparation motivation,Poignant pet perception,Cherishing ritual pattern,Pet owner influence,Attention to temporal awareness,Creation of companion animal memory,Deepened trust in love despite loss,Integration of pet experiences,Care-focused decision-making,Difficulty balancing love and dread,Pet owner identity,Animal aging situation,Human-animal bond valued
"""I alternate between feeling like I've finally found my spiritual path and doubting it's all self-delusion. Moments of transcendence are followed by crushing skepticism.""",enlightenment,"emotional reasoning, all-or-nothing thinking",spirituality,Faith with periodic uncertainty crises,Maintain specific contemplative practices while allowing questioning,Spiritual development period,Meaning with intellectual honesty motivation,Fluid faith perception,Spiritual practice pattern,Spiritual community influence,Attention to belief fluctuations,Creation of faith journey memory,Cyclical trust in spiritual path,Integration of doubt episodes,Spiritually informed decision-making,Difficulty maintaining consistent faith,Spiritual seeker identity,Spiritual questioning situation,Authentic seeking valued
"""I feel both genuine care for my aging parent and resentment about the role reversal. Changing their diaper yesterday brought up such complicated emotions I can't sort through.""",conflicted love,"emotional reasoning, should statements",family,Caregiving with ambivalence,Seek specific caregiver support while normalizing complex feelings,Caregiving adaptation period,Love with self-preservation motivation,Split care perception,Emotional processing pattern,Family duty influence,Attention to role strain,Creation of caregiving memory,Complex trust in family bonds,Integration of care experiences,Balanced life decision-making,Difficulty reconciling love and frustration,Caregiver-child identity,Parent care situation,Family obligation valued
"""I'm proud of my body's strength after injury recovery but still catch myself criticizing its scars and limitations. The appreciation feels conditional on meeting unrealistic standards.""",bittersweet joy,"mental filtering, should statements",health,Recovery with persistent body criticism,Practice specific body neutrality techniques while honoring healing,Body image integration period,Acceptance with self-compassion motivation,Skewed body perception,Body monitoring pattern,Body ideal influence,Attention to perceived flaws,Creation of recovery memory,Conditional trust in body capability,Integration of injury experiences,Health-supporting decision-making,Difficulty maintaining positive body relationship,Recovering identity,Body awareness situation,Body acceptance valued
"""I feel both excited about my creative potential and paralyzed by too many possibilities. Facing a blank canvas is equally exhilarating and terrifying.""",enthusiasm,"emotional reasoning, all-or-nothing thinking",creativity,Creative freedom with choice paralysis,Implement specific project constraints while embracing creative play,Creative development period,Expression with self-acceptance motivation,Overwhelmed creative perception,Creative avoidance pattern,Artistic community influence,Attention to creative potential,Creation of artistic possibility memory,Conditional trust in creative capacity,Similar past creative blocks,Creativity decisions influenced by fear,Difficulty initiating creative work,Emerging artist identity,Creative opportunity situation,Artistic expression valued
"""Since leaving my high-demand religion, I've felt both liberated from constraint and untethered without its structure. The freedom I fought for sometimes feels like frightening emptiness.""",conflicted relief,"emotional reasoning, mental filtering",belief system,Post-faith adjustment with identity reconstruction,Explore specific meaning-making practices while honoring transition,Belief transition period,Authenticity with self-compassion motivation,Mixed freedom perception,Values exploration pattern,Ex-religious community influence,Attention to purpose questions,Creation of transition memory,Developing trust in new belief system,Integration of faith experiences,Values-based decision-making,Difficulty building new meaning frameworks,Evolving self identity,Faith transition situation,Authentic belief valued
"""I feel both deep connection to nature and despair about ecological destruction. Every beautiful sunset now carries grief about what we're losing.""",sadness/hope,"emotional reasoning, magnification",environment,Ecological awareness with complex emotional response,Channel feelings into specific conservation actions while practicing grief processing,Environmental engagement period,Stewardship with emotional endurance motivation,Multilayered nature perception,Environmental action pattern,Ecological awareness influence,Attention to environmental changes,Creation of ecological memory,Conditional trust in planetary future,Integration of nature experiences,Environmentally informed decision-making,Difficulty balancing appreciation and grief,Environmental citizen identity,Nature observation situation,Ecological consciousness valued
"""I'm proud of building a successful business but sometimes miss the creative freedom of struggling artist days. The security comforts me but makes me worry I've sold out.""",conflicted pride,"emotional reasoning, mental filtering",career,Professional success with creative identity conflict,Carve specific creative outlets within current work while honoring growth,Professional integration period,Achievement with authenticity motivation,Split professional perception,Creative preservation pattern,Artistic community influence,Attention to identity tension,Creation of career evolution memory,Conditional trust in professional path,Integration of creative experiences,Holistic career decision-making,Difficulty integrating multiple professional selves,Entrepreneur-artist identity,Career success situation,Authentic success valued
"""I feel both tremendous gratitude for my supportive partner and guilt that I'm not equally supportive in return. Their patience sometimes highlights my own shortcomings.""",warmth,"emotional reasoning, personalization",relationship,Relationship appreciation with disproportionate self-criticism,Practice specific reciprocal caring behaviors while accepting imperfect balance,Relationship growth period,Connection with self-acceptance motivation,Skewed relationship perception,Gratitude practice pattern,Relationship ideal influence,Attention to perceived imbalance,Creation of relationship memory,Conditional trust in mutual care,Similar past relationship patterns,Relationship decisions influenced by guilt,Difficulty accepting care gracefully,Partner identity,Relationship appreciation situation,Mutual support valued
"""Since becoming disabled, I've discovered unexpected community but also rage at inaccessible spaces. The belonging and exclusion exist simultaneously, often in the same day.""",connection,"emotional reasoning, mental filtering",disability,Disability identity with access frustration,Channel anger into specific advocacy while cherishing community connections,Disability adaptation period,Justice with belonging motivation,Split disability perception,Advocacy pattern,Disability community influence,Attention to accessibility barriers,Creation of disability memory,Conditional trust in societal inclusion,Integration of disability experiences,Accessibility-conscious decision-making,Difficulty balancing acceptance and activism,Disabled identity forming,Accessibility challenge situation,Disability rights valued
"""I feel both deep pride in my cultural traditions and frustration with their limitations. The heritage that grounds me also sometimes feels like a constraint on my individuality.""",conflicted love,"emotional reasoning, all-or-nothing thinking",identity,Cultural belonging with generation gap,Curate specific selective tradition practices while honoring roots,Cultural identity integration,Authenticity with belonging motivation,Nuanced cultural perception,Cultural adaptation pattern,Family expectation influence,Attention to cultural fit,Creation of identity memory,Conditional trust in cultural home,Integration of identity experiences,Culture-conscious decision-making,Difficulty balancing tradition and individuality,Bicultural identity,Cultural expectation situation,Cultural authenticity valued
"""I alternate between feeling capable managing my mental health and complete despair during episodes. The inconsistency makes it hard to trust any sense of stability or progress.""",optimism,"emotional reasoning, mental filtering",mental health,Health fluctuation with eroded confidence,Track specific symptom patterns while developing episode coping toolkit,Health management period,Stability with self-compassion motivation,Unpredictable health perception,Adaptive management pattern,Mental health community influence,Attention to symptom variability,Creation of health adaptation memory,Conditional trust in coping capacity,Integration of health experiences,Health-informed decision-making,Difficulty maintaining consistent self-care,Mental health advocate identity,Health fluctuation situation,Mental health resilience valued
"""I feel both genuine happiness in my marriage and periodic longing for the excitement of new romance. These fantasies make me question whether I'm truly committed.""",conflicted love,"emotional reasoning, all-or-nothing thinking",relationship,Long-term partnership with occasional restlessness,Channel fantasies into specific relationship rejuvenation efforts while normalizing thoughts,Marriage enrichment period,Commitment with self-honesty motivation,Fluid relationship perception,Fantasy management pattern,Marriage narrative influence,Attention to relationship fluctuations,Creation of marriage complexity memory,Conditional trust in relationship satisfaction,Integration of relationship phases,Relationship decisions influenced by introspection,Difficulty balancing stability and novelty,Partner identity,Marriage routine situation,Long-term love valued
"""Since becoming sober, I've gained clarity but also face difficult truths about my past. The honesty liberates me but some memories fill me with crushing shame.""",transformation,"emotional reasoning, mental filtering",addiction,Sobriety with emotional turbulence,Process specific memories in therapy while practicing self-compassion,Recovery process,Healing with self-acceptance motivation,Mixed sobriety perception,Emotional processing pattern,Recovery community influence,Attention to past behaviors,Creation of recovery memory,Growing trust in sober self,Integration of addiction experiences,Recovery-supporting decision-making,Difficulty reconciling past actions,Recovering identity,Sobriety milestone situation,Recovery honesty valued
"""I feel both deep connection to my hometown and suffocation by its limitations. Visiting brings comfort but also reminds me why I left.""",connection,"emotional reasoning, all-or-nothing thinking",identity,Place attachment with complex emotional layers,Honor roots while maintaining specific boundaries during visits,Place relationship period,Belonging with growth motivation,Bittersweet home perception,Visitation ritual pattern,Family expectation influence,Attention to place meaning,Creation of home memory,Conditional trust in multiple belongings,Integration of relocation experiences,Place-conscious decision-making,Difficulty balancing connection and freedom,Evolving self identity,Home visit situation,Rootedness valued
"""I alternate between feeling like I've finally found my life's purpose and complete uncertainty about what matters. My clarity feels fragile, like one setback could shatter it.""",self-discovery,"emotional reasoning, catastrophizing",life purpose,Meaning-seeking with persistent doubt,Develop specific values clarification practices while accepting uncertainty,Purpose exploration period,Meaning with self-compassion motivation,Fluid purpose perception,Meaning-seeking pattern,Life stage influence,Attention to existential questions,Creation of purpose memory,Conditional trust in life direction,Integration of purpose experiences,Values-based decision-making,Difficulty maintaining consistent purpose,Seeker identity,Life transition situation,Meaningful living valued
"""I feel both pride in my independence and loneliness from being too self-reliant. My strength has become isolation, but vulnerability still terrifies me.""","loneliness, defiance","emotional reasoning, all-or-nothing thinking",personal growth,Self-sufficiency with connection barriers,Practice specific small vulnerability steps while honoring independence,Relationship development period,Connection with self-protection motivation,Split self-perception,Self-reliance pattern,Independence ideal influence,Attention to social risk,Creation of independence memory,Conditional trust in others,Similar past vulnerability fears,Social decisions influenced by protection,Difficulty balancing autonomy and connection,Independent identity,Vulnerability situation,Authentic connection valued
"""Since my spiritual awakening, I've experienced profound peace but also alienation from old friends who don't understand my journey. The depth fulfills me but sometimes makes ordinary interactions feel empty.""",enlightenment,"emotional reasoning, mental filtering",spirituality,Spiritual growth with social integration challenge,Cultivate specific like-minded connections while practicing presence with old friends,Spiritual integration period,Meaning with belonging motivation,Split social perception,Spiritual practice pattern,Spiritual community influence,Attention to connection quality,Creation of awakening memory,Conditional trust in spiritual path,Integration of spiritual experiences,Spiritually informed decision-making,Difficulty balancing depth and social connection,Spiritual seeker identity,Spiritual growth situation,Authentic seeking valued
"""I feel both deep love for my child and resentment about lost career opportunities. The joy they bring is real, but so is my grief for professional paths not taken.""",conflicted love,"emotional reasoning, should statements",parenting,Parental ambivalence with career grief,Create specific professional development adaptations while honoring parenting role,Work-life integration period,Fulfillment with self-compassion motivation,Split life perception,Career preservation pattern,Parenting ideal influence,Attention to role conflict,Creation of parenting complexity memory,Conditional trust in life choices,Integration of career experiences,Holistic life decision-making,Difficulty integrating multiple roles,Parent-professional identity,Parenting challenge situation,Balanced life valued
"""I alternate between feeling like I'm making progress in therapy and complete despair that I'll never change. Insights feel powerful in session but distant during daily struggles.""","self-doubt, defiance","emotional reasoning, all-or-nothing thinking",mental health,Therapeutic progress with inconsistent integration,Implement specific between-session practice while acknowledging nonlinear growth,Therapy process period,Growth with self-acceptance motivation,Volatile progress perception,Skill application pattern,Therapeutic influence,Attention to change indicators,Creation of therapy memory,Conditional trust in change process,Similar past therapeutic cycles,Growth-oriented decision-making,Difficulty maintaining therapeutic gains,Evolving self identity,Therapy challenge situation,Psychological growth valued
"""I feel both excitement about my new relationship and fear it will end like my last one. Every positive moment is shadowed by anticipation of eventual pain.""",joy with anxiety,"emotional reasoning, fortune telling",relationship,New love with past relationship contamination,Practice specific present-moment focus while acknowledging protective impulses,Relationship development period,Connection with self-protection motivation,Threat-filtered joy perception,Emotional guarding pattern,Past relationship influence,Attention to risk signs,Creation of new relationship memory,Conditional trust in love,Integration of past hurts,Relationship decisions influenced by past,Difficulty balancing openness and protection,Partner identity forming,New relationship situation,Romantic connection valued
"""Since coming out as transgender, I've felt both authentic and vulnerable in ways I never anticipated. Being seen as my true self is exhilarating but also exposes me to new forms of scrutiny.""",transformation,"emotional reasoning, mental filtering",identity,Gender transition with complex social navigation,Develop specific support networks while celebrating authentic expression,Gender integration period,Authenticity with self-protection motivation,Multilayered transition perception,Authenticity practice pattern,LGBTQ+ community influence,Attention to social safety,Creation of transition memory,Growing trust in authentic self,N/A,Identity-congruent decision-making,Difficulty balancing visibility and safety,Transgender identity,Post-coming out situation,Authentic living valued
"""I feel both deep connection to my ethnic heritage and frustration with its gender expectations. The culture that grounds me also sometimes feels like a constraint on my identity.""",connection,"emotional reasoning, all-or-nothing thinking",identity,Cultural belonging with gender role conflict,Curate specific selective tradition practices while advocating for change,Cultural identity integration,Authenticity with belonging motivation,Nuanced cultural perception,Cultural adaptation pattern,Family expectation influence,Attention to cultural tensions,Creation of identity memory,Conditional trust in cultural evolution,Integration of identity experiences,Culture-conscious decision-making,Difficulty balancing tradition and individuality,Bicultural identity,Cultural expectation situation,Cultural authenticity valued
"""I alternate between feeling capable as a new parent and complete overwhelm. The love is real but so is the exhaustion, and I worry these difficult moments mean I'm failing.""",mixed joy/sadness,"emotional reasoning, magnification",parenting,New parent adjustment with unrealistic expectations,Implement specific self-care practices while normalizing parenting challenges,Early parenting period,Connection with self-preservation motivation,Skewed parenting perception,Survival mode pattern,Parenting ideal influence,Attention to perceived shortcomings,Creation of parenting memory,Conditional trust in parenting capacity,N/A,Parenting decisions influenced by fatigue,Difficulty maintaining balanced perspective,New parent identity,Parenting challenge situation,Intensive parenting valued
"""I feel both pride in my recovery from addiction and shame about past behaviors. My progress is real, but memories of harm I caused still haunt me.""",conflicted pride,"emotional reasoning, mental filtering",addiction,Recovery with persistent shame,Process specific amends while practicing self-forgiveness,Recovery maintenance period,Healing with self-acceptance motivation,Split recovery perception,Amends-making pattern,Recovery community influence,Attention to past actions,Creation of recovery memory,Conditional trust in reformed self,Integration of addiction experiences,Recovery-supporting decision-making,Difficulty reconciling past and present,Recovering identity,Recovery milestone situation,Recovery integrity valued
"""Since leaving my corporate job to freelance, I've felt both liberated from routine and terrified by instability. The freedom I craved sometimes feels like reckless irresponsibility.""",conflicted relief,"emotional reasoning, all-or-nothing thinking",career,Professional reinvention with financial anxiety,Create specific financial stability plans while honoring career autonomy,Career transition period,Freedom with security motivation,Mixed work perception,Structure-building pattern,Entrepreneurial influence,Attention to financial indicators,Creation of career change memory,Conditional trust in professional path,Similar past career risks,Career decisions influenced by security,Difficulty balancing freedom and stability,Entrepreneur identity,Career change situation,Professional autonomy valued
"""I feel both deep love for my partner and frustration about our communication patterns. The foundation is strong but our recurring arguments make me question long-term compatibility.""",conflicted love,"emotional reasoning, mental filtering",relationship,Secure attachment with communication challenges,Learn specific conflict resolution skills while honoring relationship strengths,Relationship growth period,Connection with improvement motivation,Nuanced relationship perception,Argument analysis pattern,Relationship ideal influence,Attention to communication patterns,Creation of relationship complexity memory,Conditional trust in relationship resilience,Integration of relationship history,Relationship decisions influenced by growth,Difficulty breaking negative cycles,Partner identity,Communication challenge situation,Relationship growth valued
"""I alternate between feeling like I'm finally healing from trauma and complete retraumatization by triggers. Progress feels real until a flashback convinces me I'll never recover.""",optimism,"emotional reasoning, all-or-nothing thinking",trauma,Trauma recovery with nonlinear healing,Develop specific trigger management tools while acknowledging progress,Trauma integration period,Safety with self-compassion motivation,Volatile healing perception,Grounding practice pattern,Therapeutic influence,Attention to healing indicators,Creation of recovery memory,Conditional trust in healing capacity,Integration of trauma experiences,Recovery-supporting decision-making,Difficulty maintaining healing perspective,Survivor identity,Trigger situation,Trauma recovery valued
