text,emotion,bias/distortion,context,feedback/insight,behavioral_recommendation,progress_tracking,motivation,perception,habit,social_influence,attention,memory,trust,past_experience,decision_making,adaptive_behavior,identity,situational_trigger,cultural
"""I always mess up at work meetings. No one takes me seriously.""","Frustration, Self-doubt","Overgeneralization, All-or-nothing thinking","Work performance, Social anxiety","""You're using absolute terms like 'always'—this may exaggerate reality. Reflect on past successful contributions.""","""Try journaling 3 positive meeting experiences to counterbalance.""","""Noticing cognitive distortions""",Low confidence,Self-critical,Negative self-talk,Focus on failures,Selective recall,Low self-trust,Past criticism,Avoidance,Self-sabotage,"""I'm incompetent""",High-pressure meeting,Individualistic,
"""Why does everyone ignore me? They must think I’m boring.""","Loneliness, Rejection","Mind-reading, Personalization",Social interactions,"""Assuming others' thoughts ('must think') can lead to misjudgment. Have you asked for feedback?""","""Engage in one small social interaction daily to test assumptions.""","""Reducing mind-reading""",Seeking connection,Distorted social cues,Isolation,Hyper-vigilance to rejection,Negative memories,Low trust in peers,Past exclusion,Social withdrawal,Defensive behavior,"""I'm unlikable""",Group settings,Collectivist,
"""If I don’t get this promotion, my career is over.""","Anxiety, Pressure",Catastrophizing,Career growth,"""This 'all-or-nothing' thinking amplifies stress. Are there alternative paths to success?""","""List 3 backup plans to reduce fixation on one outcome.""","""Challenging catastrophic thoughts""",High ambition,Tunnel vision,Perfectionism,Competitive workplace,Overfocus on threat,Past failures,Fear of uncertainty,Risk aversion,Rigid planning,"""My worth = my job""",Upcoming review,High-achievement culture,
"""I can’t trust anyone. They always betray me.""","Anger, Distrust",Confirmation bias,Relationships,"""Generalizing from past hurts may close you off to new connections. Are there exceptions?""","""Identify one person who has been reliable to reframe perspective.""","""Rebuilding trust slowly""",Protective,Hyper-alert to betrayal,Distrusting others,Negative peer experiences,Selective attention to betrayal,Strong recall of betrayals,Very low,Past betrayals,Isolation,Defensiveness,"""I’m always hurt""",New friendships,Trauma background
"""I’ll never be as good as them. Why even try?""","Envy, Helplessness","Comparison, Discounting positives",Self-improvement,"""Comparing yourself to others ignores your unique progress. What’s one small win this week?""","""Practice self-compassion by writing 3 strengths you possess.""","""Reducing comparison""",Demotivated,Unfair self-assessment,Negative self-evaluation,Social media influence,Focus on others' success,Minimizing own achievements,Low self-trust,Past failures,Avoidance,Fixed mindset,"""I’m not enough""",Seeing others' success,Meritocratic
"""I always mess up at work meetings.""","Frustration, Shame",Overgeneralization,Workplace performance,"""Absolute terms like 'always' distort reality. Recall 1-2 meetings that went well.""","""Track meeting outcomes objectively for 1 week.""","""Noticing black-and-white thinking""",Low confidence,Self-as-failure,Negative self-talk,Competitive colleagues,Focus on mistakes,Selective recall,Low (self),Past criticism,Avoidance,Self-sabotage,"""I’m incompetent""",Public speaking,Individualistic
"""No one likes me—I’m unlovable.""",Loneliness,"Personalization, Labeling",Social relationships,"""You’re assuming others’ thoughts. Challenge this with evidence.""","""Initiate 1 low-stakes social interaction.""","""Reducing mind-reading""",Seeking connection,Distorted social cues,Isolation,Social media comparisons,Hyper-alert to rejection,Vivid negative memories,Low (others),Past rejection,Withdrawal,Defensive,"""I’m unworthy""",Group gatherings,Collectivist
"""If I fail this exam, my life is ruined.""",Anxiety,Catastrophizing,Academic pressure,"""This ‘worst-case’ thinking amplifies stress. List alternative outcomes.""","""Practice grounding techniques before tests.""","""Challenging catastrophizing""",High fear,Tunnel vision,Perfectionism,Parental expectations,Overfocus on threat,Recalls past failures,Medium,Previous poor grades,Procrastination,Rigid planning,"""I must be perfect""",Exam season,High-achievement
"""They ignored me because I’m boring.""",Rejection,Mind-reading,Social interaction,"""You can’t know others’ thoughts without asking. Consider other explanations.""","""Ask a friend for honest feedback.""","""Identifying projection""",Insecure,Assumed disapproval,Self-criticism,Peer rejection,Selective attention,Negative bias,Low (peers),Childhood exclusion,People-pleasing,Over-apologizing,"""I’m forgettable""",Parties,Western
"""Why try? I’ll never succeed.""",Hopelessness,Discounting positives,Career goals,"""You’re overlooking past progress. List 3 small wins this month.""","""Set a micro-goal (e.g., 10 mins of work).""","""Building self-efficacy""",Demotivated,Defeatist,Procrastination,Unrealistic role models,Focus on others’ success,Minimizes achievements,Low (self),Past setbacks,Avoidance,Fixed mindset,"""I’m a failure""",Seeing peers’ success,Meritocratic
"""My boss didn’t reply to my email. They must be mad at me.""","Anxiety, Self-doubt","Mind-reading, Jumping to conclusions",Workplace communication,"""Assuming negative intent without evidence fuels anxiety. Consider neutral explanations (e.g., busy schedule).""","""Send a polite follow-up instead of ruminating.""","""Reducing mind-reading""",Fear of rejection,Hyper-vigilance to criticism,Overanalyzing,Hierarchical workplace,Focus on silence,Recalls past conflicts,Medium (boss),Previous reprimands,Over-apologizing,People-pleasing,"""I’m disposable""",Email delays,Corporate culture
"""I ate junk food today. I have no self-control.""","Guilt, Shame","Labeling, All-or-nothing thinking",Health habits,"""One lapse doesn’t define you. Avoid moralizing food (‘good’ vs. ‘bad’).""","""Plan a balanced meal next time without guilt.""","""Building self-compassion""",High standards,Self-punitive,Emotional eating,Diet culture,"Fixation on ""failure""","Recalls only ""failures""",Low (self),Yo-yo dieting,Impulse decisions,Restriction cycles,"""I’m undisciplined""",Stressful day,Western beauty standards
"""She’s so successful, and I’m stuck. It’s not fair.""","Envy, Resentment","Comparison, Discounting positives",Career comparison,"""Comparing your Chapter 1 to someone’s Chapter 10 distorts reality. List your own progress.""","""Write a ‘growth list’ of skills you’ve learned.""","""Reducing social comparison""",Demoralized,Unfair self-assessment,Scrolling LinkedIn,Social media highlight reels,Focus on others,Minimizes own growth,Low (self),Past stagnation,Complaining,Passive waiting,"""I’m behind""",Seeing promotions,Competitive culture
"""I can’t say no. They’ll think I’m selfish.""","Anxiety, Obligation","Mind-reading, Should statements",Boundaries,"""Prioritizing others’ needs over yours leads to burnout. Saying ‘no’ is healthy.""","""Practice declining one small request this week.""","""Assertiveness training""",Fear of disapproval,Self-as-doormat,Overcommitment,Family guilt,Hyperfocus on others’ reactions,Recalls rejection,Low (self),"Childhood praise for ""niceness""",Avoidant,Fawning,"""I’m only valued for helping""",Requests for favors,Collectivist family
"""I’ll never find love. I’m too old/weird/broken.""",Hopelessness,"Overgeneralization, Emotional reasoning",Dating,"""Absolute statements (‘never’) ignore possibilities. Challenge with counterexamples.""","""Join a hobby group to meet people organically.""","""Rebuilding hope""",Loneliness,Defeatist,Isolation,Romantic media,Focus on flaws,Vivid past rejections,Low (others),Bad breakups,Self-sabotage,Withdrawal,"""I’m unlovable""",Valentine’s Day,Romantic idealism
"""I panicked during the presentation. Everyone noticed.""","Embarrassment, Shame","Spotlight effect, Catastrophizing",Public speaking,"""Audiences rarely notice mistakes as much as you do. Recall a time you enjoyed a speaker’s authenticity.""","""Practice grounding techniques (e.g., 4-7-8 breathing).""","""Anxiety management""",Perfectionism,Self-as-spectacle,Avoidance,High-expectation workplace,Hyperfocus on self,Recalls only mistakes,Medium (peers),Past embarrassment,Over-preparation,Rigid scripts,"""I’m a fraud""",Performance reviews,High-pressure
"""Why can’t I just be normal?""",Self-loathing,"Mental filter, Should statements",Self-acceptance,"""‘Normal’ is a myth. You’re comparing your behind-the-scenes to others’ highlight reels.""","""List 3 unique traits you appreciate about yourself.""","""Self-acceptance practice""",Shame,Distorted self-image,Negative self-talk,Social conformity,Focus on perceived flaws,Filters out positives,Low (self),Bullying/ostracization,Conformity,Masking,"""I’m defective""",Social events,Stigma around neurodiversity
"""I’ll start tomorrow… but I never do.""","Guilt, Procrastination","Present bias, All-or-nothing thinking",Productivity,"""Waiting for ‘perfect’ motivation is a trap. Start with a 2-minute version of the task.""","""Use the ‘2-minute rule’ to break inertia.""","""Building momentum""",Low self-efficacy,Task-as-monolith,Avoidance,Hustle culture,Overfocus on future self,Recalls past procrastination,Low (self),Unfinished projects,Delay,All-or-nothing cycles,"""I’m lazy""",Deadline looming,Productivity guilt
"""They didn’t laugh at my joke. I’m so awkward.""",Embarrassment,"Personalization, Mind-reading",Social anxiety,"""Humor is subjective. Their reaction may have nothing to do with you.""","""Try observing others’ jokes that ‘flop’ without judgment.""","""Reducing self-consciousness""",Fear of rejection,Self-as-burden,Overanalyzing,Peer approval,Hyperfocus on silence,Recalls awkward moments,Low (peers),Teenage teasing,Social withdrawal,Over-apologizing,"""I’m cringe""",Group hangouts,High-context communication
"""I don’t deserve this promotion. It was luck.""",Imposter syndrome,"Discounting positives, Labeling",Career achievement,"""You’re attributing success to luck, not skill. List 5 contributions you made.""","""Keep an ‘achievement file’ for moments of doubt.""","""Owning accomplishments""",Self-doubt,Success-as-fluke,Minimizing,Competitive peers,"Focus on ""luck""",Filters out successes,Low (self),Dismissive upbringing,Under-selling,Overworking,"""I’m a fake""",Positive feedback,Meritocracy myth
"""I should be further along in my career by now. I'm such a failure.""","Shame, Frustration","Unrealistic expectations, Comparison",Career progression,"""Comparing your timeline to others ignores your unique path. Many successful people had nonlinear journeys.""","""List 3 valuable skills you've gained regardless of timeline.""","""Challenging social clock beliefs""",High self-criticism,"Tunnel vision on ""shoulds""",Negative self-talk,Professional social media,Focus on perceived lack,Recalls only setbacks,Low (self),Parental pressure,Risk-averse,Self-sabotage,"""I'm behind""",Alumni reunions,Achievement-oriented
"""One negative comment ruined my whole day. Why do I focus on the bad?""","Sadness, Sensitivity","Negativity bias, Emotional reasoning",Emotional regulation,"""Our brains are wired to remember negatives more - this is normal but can be managed.""","""Practice 'balanced recalling' - list 1 neutral and 1 positive interaction too.""","""Building emotional resilience""",Approval-seeking,Threat-focused,Rumination,Critical family members,Hyper-focus on criticism,Strong recall of negatives,Medium (others),Childhood criticism,Avoidance,People-pleasing,"""I'm too sensitive""",Performance feedback,High-context
"""If I speak up about needing help, they'll think I'm weak.""","Anxiety, Pride","Mind-reading, All-or-nothing thinking",Workplace communication,"""Asking for help is a sign of professionalism, not weakness. Most teams value honesty.""","""Start small - ask for clarification on one task this week.""","""Practicing vulnerability""",Fear of judgment,Help-seeking as failure,Independence,Competitive work environment,Focus on perceived judgment,Past moments of rejection,Low (colleagues),Punished for mistakes,Perfectionism,Overworking,"""I must be self-sufficient""",New projects,Masculinity norms
"""I keep imagining worst-case scenarios about my health. What if the doctor finds something terrible?""","Fear, Anxiety","Catastrophizing, Probability overestimation",Health anxiety,"""The brain treats imagined threats as real. Remember: thoughts are not facts or predictions.""","""Write down the actual statistical probabilities of your fears.""","""Reducing catastrophic thinking""",Safety-seeking,Hyper-vigilance to symptoms,Googling symptoms,Alarmist media,Body scanning,Vivid recall of rare cases,Low (medical system),Family health scares,Avoidance of checkups,Excessive testing,"""I'm fragile""",Upcoming appointment,Trauma history
"""Everyone else has their life together except me.""","Loneliness, Inadequacy","Comparison, Mental filtering",Life satisfaction,"""Social media shows curated highlights. Most people struggle privately too.""","""Do a 'reality check' - list 3 areas where you're doing okay.""","""Countering comparison""",Despair,Distorted social comparison,Social media scrolling,Highlight reels,Focus on others' successes,Filters out own progress,Medium (self),Childhood instability,Paralysis,Self-neglect,"""I'm broken""",Holiday gatherings,Perfectionist
"""I said something awkward and now they'll never respect me.""","Embarrassment, Regret","Magnification, Permanence bias",Social interaction,"""Most people forget minor social slips quickly. We remember our own much longer.""","""Recall an awkward moment someone else had that you forgave easily.""","""Developing self-compassion""",Shame,Hyper-awareness of self,Over-apologizing,Judgmental peers,Fixation on mistake,Vivid recall of past slips,Low (self),Bullying history,Social avoidance,Masking,"""I'm socially inept""",Networking events,High-context
"""Why bother trying? Nothing ever works out for me.""","Hopelessness, Resignation","Overgeneralization, Discounting positives",Motivation,"""This belief filters out evidence to the contrary. List small past successes.""","""Set a tiny, achievable goal to rebuild confidence.""","""Breaking helplessness cycle""",Defeatism,Tunnel vision,Giving up easily,Negative peer group,Focus on failures,Minimizes wins,None,Repeated setbacks,Avoidance,Passive,"""I'm unlucky""",Setbacks,Poverty mindset
"""I must get everything perfect or it's worthless.""","Anxiety, Pressure","Perfectionism, All-or-nothing thinking",Work quality,"""Perfect is the enemy of good. Most real-world work is 80% excellent.""","""Deliberately submit something at 85% completion.""","""Practicing 'good enough'""",Fear of failure,Distorted standards,Over-editing,High-achieving family,Hyper-focus on flaws,Recalls only imperfections,Low (self),Conditional praise,Procrastination,Overwork,"""My worth = output""",Deadlines,Elite education
"""They didn't text back immediately. I must have said something wrong.""","Anxiety, Rejection","Personalization, Jumping to conclusions",Relationships,"""Most delays have simple explanations (busy, distracted) unrelated to you.""","""Practice 'alternative explanations' thinking.""","""Reducing attachment anxiety""",Insecurity,Threat interpretation,Checking phone,Inconsistent parenting,Hyper-vigilance to silence,Past abandonment,Low (partner),Unreliable caregivers,Protest behaviors,Clinginess,"""I'm too needy""",New relationship,Anxious attachment
"""I don't deserve to take a break - lazy people rest.""","Guilt, Self-punishment","Should statements, Moral labeling",Work-life balance,"""Rest is biological necessity, not moral failing. Productivity requires recovery.""","""Schedule short breaks as non-negotiable appointments.""","""Legitimizing rest""",Burnout,Rest as weakness,Overworking,Hustle culture,Focus on tasks undone,"Recalls ""lazy"" labels",Low (self),Performance-based love,Workaholism,Ignoring limits,"""I must earn rest""",Vacation time,Protestant work ethic
"""My anxiety is unbearable. I can't handle this feeling.""","Panic, Overwhelm","Catastrophizing, Emotional reasoning",Emotional tolerance,"""Anxiety peaks then passes. You've survived 100% of past anxious moments.""","""Practice 'urge surfing' - observe anxiety like a wave.""","""Building distress tolerance""",Fear of fear,Sensation as threat,Avoidance,Stigma around mental health,Body scanning,Recalls worst episodes,Low (self),Trauma history,Safety behaviors,Escape,"""I'm fragile""",Physical symptoms,Stoicism
"""If I'm not the best, I might as well quit.""",Defeatism,"All-or-nothing thinking, Discounting positives",Competition,"""Life isn't binary. There's value in good, better, and best attempts.""","""List 3 benefits of participating regardless of ranking.""","""Challenging extremes""",External validation,Winning as only option,Giving up easily,Competitive siblings,Focus on top spot,Filters out middle successes,Low (self),Conditional approval,Avoidance,Black-and-white,"""I'm nothing if not #1""",Tryouts/auditions,Performance-based worth
"""I can't stop thinking about that embarrassing thing from 5 years ago.""","Shame, Regret","Rumination, Magnification",Past events,"""Others likely don't remember, and it doesn't define you now.""","""Write a letter to your past self with compassion.""","""Processing old shame""",Self-punishment,Frozen in past,Mental replay,Critical upbringing,Fixation on event,Vivid recall,Low (self),Childhood shame,Avoidance,Self-sabotage,"""I'm my mistakes""",Similar situations,Honor culture
"""I need to prepare for every possible question or I'll look stupid.""",Anxiety,"Overestimation of threat, Perfectionism",Performance situations,"""Competent people say 'I don't know' too. Preparation has diminishing returns.""","""Practice answering 1 question spontaneously.""","""Reducing over-preparation""",Fear of exposure,Self-as-imposter,Over-researching,Academic pressure,Hyper-vigilance to gaps,Recalls knowledge gaps,Low (self),Humiliation experiences,Over-planning,Procrastination,"""I must know everything""",Q&A sessions,Expert culture
"""My friend seems distant. Did I do something wrong?""","Anxiety, Loneliness","Personalization, Mind-reading",Friendship,"""Mood changes often reflect others' internal states, not your actions.""","""Send a check-in text without assuming blame.""","""Reducing personalization""",Fear of abandonment,Threat detection,Seeking reassurance,Insecure attachment,Hyper-focus on changes,Recalls lost friendships,Medium (others),Unstable relationships,People-pleasing,Clinginess,"""I drive people away""",Change in communication,Interdependent
"""I failed one test - I'll never get into college now.""","Panic, Despair","Catastrophizing, All-or-nothing thinking",Academic pressure,"""Single events rarely determine outcomes. Many successful people failed tests.""","""List 3 alternative paths to your goal besides perfect grades.""","""Reducing academic catastrophizing""",Fear of future,Tunnel vision,Overstudying,Tiger parenting,Focus on worst outcome,Recalls only failures,Low (system),High expectations,Paralysis,Overcompensation,"""I'm my GPA""",Grading periods,Academic elitism
"""They didn't invite me - everyone must hate me.""","Rejection, Loneliness","Overgeneralization, Mind-reading",Social exclusion,"""One omission doesn't reflect universal opinion. Recall recent positive interactions.""","""Initiate contact with one friend to test your assumption.""","""Challenging rejection sensitivity""",Need to belong,Threat detection,Social withdrawal,Cliquish environment,Hyperfocus on exclusion,Vivid recall of rejections,Low (peers),Childhood bullying,Avoidance,Isolating,"""I'm unlikable""",Social media posts,Group-oriented
"""I can't stop thinking about what I should have said.""","Regret, Frustration","Rumination, Hindsight bias",Past conversations,"""The perfect response rarely exists. Others likely remember the conversation differently.""","""Practice thought-stopping technique after 2 minutes of replaying.""","""Managing rumination""",Perfectionism,Distorted recall,Mental rehearsals,Critical authority figures,"Fixation on ""flaws""",Enhanced memory of slips,Low (self),Punished for misspeaking,Over-preparation,People-pleasing,"""I'm inarticulate""",Important meetings,High-context
"""I don't deserve this compliment - they're just being nice.""","Discomfort, Suspicion","Discounting positives, Mind-reading",Positive feedback,"""Accepting praise doesn't require perfection. Consider they might genuinely mean it.""","""Say 'thank you' without qualification next time.""","""Practicing praise acceptance""",Low self-worth,Success as accidental,Deflecting,Critical upbringing,"Focus on ""ulterior motives""",Filters out compliments,Low (others),Backhanded compliments,Self-deprecation,Minimizing,"""I'm a fraud""",Performance reviews,Modesty norms
"""If I relax, everything will fall apart.""","Anxiety, Hypervigilance","Overestimation of control, Catastrophizing",Work-life balance,"""Systems are more resilient than we think. Chronic stress actually reduces effectiveness.""","""Schedule 15 minutes of guilt-free relaxation daily.""","""Building tolerance to downtime""",Fear of collapse,Control as safety,Overfunctioning,Chaotic family history,Scanning for problems,Recalls times things went wrong,Low (world),Parental instability,Micromanaging,Burnout,"""I'm the glue""",Vacation planning,Crisis mentality
"""I should be over this by now. What's wrong with me?""","Shame, Impatience","Should statements, Unrealistic expectations",Grief/healing,"""Healing isn't linear. Comparing your process to imaginary standards creates suffering.""","""Track small signs of progress rather than binary 'healed' states.""","""Developing self-compassion""",Self-criticism,Progress as all-or-nothing,Pushing down emotions,"""Just move on"" messages","Focus on ""lack""",Minimizes small improvements,Low (self),Dismissed emotions,Avoidance,Numbing,"""I'm broken""",Anniversaries,Stoic culture
"""One negative review means I'm terrible at my job.""","Devastation, Self-doubt","Mental filter, Overgeneralization",Professional feedback,"""Even the best receive criticism. Look at your feedback patterns, not single data points.""","""Make a balanced list of positive and constructive feedback.""","""Developing professional resilience""",Perfectionism,Threat magnification,Overwork,Competitive field,Hyperfocus on criticism,Recalls only negatives,Low (self),Harsh evaluations,Risk-aversion,Overcompensation,"""I'm my performance""",Annual reviews,Meritocracy
"""I can't ask for what I need - I'll burden others.""","Guilt, Resentment","Mind-reading, Should statements",Needs expression,"""Relationships require mutual giving. Your needs are as valid as others'.""","""Practice making one small request this week.""","""Assertiveness training""",Fear of rejection,Needs as shameful,Self-neglect,Parentified childhood,Monitoring others' moods,Recalls rejection,Low (others),Needs punished,Passive-aggression,Fawning,"""I'm too much""",Conflict situations,Self-sacrifice norms
"""This relationship isn't perfect, so it must be wrong.""","Doubt, Restlessness","All-or-nothing thinking, Perfectionism",Romantic relationship,"""No relationship is perfect. The 'perfect partner' myth harms real connections.""","""List 3 realistic strengths of your relationship.""","""Challenging romantic idealism""",Unrealistic expectations,Disappointment focus,Comparison,Romantic comedies,Scanning for flaws,Idealized past relationships,Medium (partner),Parental divorce,Avoidant,Grass-is-greener,"""I'm settling""",Wedding invitations,Soulmate culture
"""I'm not officially diagnosed, so my struggles don't count.""","Invalidation, Shame","Disqualifying positives, Comparison",Mental health,"""Your experience is valid regardless of labels. Many face similar challenges without diagnoses.""","""Practice self-validation: 'This is hard for me, and that's okay.'""","""Building self-trust""",Self-doubt,Experience as illegitimate,Minimizing,Medical gaslighting,"Focus on ""proof""",Recalls dismissal,Low (systems),Dismissed symptoms,Avoidance,Over-explaining,"""I'm exaggerating""",Health forms,Diagnostic hierarchy
"""If I'm not constantly productive, I'm wasting my life.""","Anxiety, Guilt","Should statements, Overgeneralization",Time management,"""Rest and reflection are productive. Human worth isn't measured in output.""","""Schedule 'being time' with no goals, just existence.""","""Reducing productivity guilt""",Existential fear,Time as enemy,Hustling,Capitalism,Clock-watching,"Recalls ""wasted"" time",Low (self),Conditional love,Over-scheduling,Burnout,"""I'm my output""",Free time,Protestant ethic
"""My therapist was 5 minutes late - they must not care.""","Abandonment, Anger","Personalization, Jumping to conclusions",Therapeutic relationship,"""Small scheduling issues rarely reflect deeper feelings. Recall evidence of their care.""","""Bring this concern directly to your therapist to discuss.""","""Working through attachment""",Fear of rejection,Rejection sensitivity,Testing others,Unreliable caregivers,Hypervigilance to timing,Past abandonment,Medium (therapist),Inconsistent parenting,Protest behaviors,Withdrawal,"""I'm unworthy""",Session transitions,Clinical setting
